fine yes even though the base is a bit thin but still pretty pollll; 1; acc; 5
the motive is nice, cute but the material is not stretchy enough; 1; acc; 5
Not bad for a cheap price but not cheap, definitely satisfied shopping here; 1; acc; 5
The headband is nice and comfortable to wear. The fabric is also very good; 1; acc; 5
wauuw the goods are really good, complete according to order, nothing is missing, cucok meow, tx seller good luck; 1; acc; 5
The bond is uculll parahhhh ..... sorry cman buy a little .....; 1; acc; 5
The item is complete and arrived safely..a little doubt, buy it here, because many say the item arrived incomplete, but my item came complete..hikss I was touched .. the packaging was fast and the delivery was ugha fast .. thanks brother🥰; 1; acc; 5
Good items according to good prices to use, recommended next order again; 1; acc; 5
Even though the price is cheap but the quality is good and fits the photos. Puasss. ; 1; acc; 5
The material is stiff and doesn't stretch. But it fits the same, the price is cheap; 1; acc; 5
cool! the ingredients are really small but I like them; 1; acc; 5
Really like the product😍 The material is really good, comfortable to wear The price is also affordable😘; 1; acc; 5
Pokonya Mantull Deh Shop Here Even though there is something missing + his watch is dead 1 But the seller is very good, he wants compensation 😋😚 Thank You; 1; acc; 5
The products are not scuffed or less 🥰 like to shop here 🤗 subscribe to it😘; 1; acc; 5
Good for everything the headband is beautiful in color according to the photo; 1; acc; 5
Thank you, the item has come completely without being lacking and very satisfied ... next time I will order again hehehe, thank you very much 🙏; 1; acc; 5
Beautiful colors and motifs, neat stitches, right on the head, thank you seller; 1; acc; 5
Thank you sis the goods have arrived according to the realpic in the picture like the ingredients are also good, lope lope anyway; 1; acc; 5
Alhamdulillah, all the items I ordered were really good and there were no defects, no complaints, thank you, I hope we subscribe; 1; acc; 5
Not bad at that price, but yeah it's a bit thin, but it's still good, it suits you, it's bright yellow color, it's already a bit thin; 1; acc; 5
It's really good, like the clasp is thick hehehe, but there is a necklace that didn't send, I hope the next order will be tucked in, right?; 1; acc; 5
shopping for the second time in this shop is never disappointed, thank God, I got a bonus hat😆🥰🥰🥰🥰; 1; acc; 5
to be sold again, this is really worth it but please don't let it be less than 1 and even though it is less than 1, the admin is responsible, thank you very much🤗; 1; acc; 5
The headband is just right when used, not too tight, cheap anymore, thanks sis; 1; acc; 5
The ones who sell are good. I thought when he opened the package he sent the wrong color of the clock. Uh, apparently he gave me a bonus. Good wes pokoee; 1; acc; 5
quality of goods in accordance with what is offered. very competitive prices compared to other stores. cheap! the shop is also complete. so you can also shop for other goods. definitely continue to subscribe to this shop because the quality of the goods is good and sent to order. there are also many kinds. thanks ..; 1; acc; 5
from all, I think I like this one the most, it's really good, like the motive is soooooo much hehehe thanks; 1; acc; 5
Good thanks, Alhamdulillah mandate this time the watch is all on ,,, thank you, good luck always and always trust to subscribe, God willing, thank you; 1; acc; 5
Ihhh like how the bandana is super cute, I ordered another motif, yey; 1; acc; 5
Uwuuuu ..... the stuff is really good and the price of the bandana is cheap but the quality is really good ... the pok is not sorry to buy at the shope and the courier is friendly too, uwu ..... deh🥰😘😘; 1; acc; 5
The material is good, as stated in the description .. The delivery is also fast, very comfortable to use .. Suitable for resale, the price is MURCE !; 1; acc; 5
Nice watch, to order, real pict, murce price. Unfortunately the packaging is long .... But satisfied with the goods. Mksih .; 1; acc; 5
Why is it that the one handle is difficult to open, so it can't be used. I am very disappointed; 0; acc; 2
My order is less than 10 socks and 2 popsocets. The return of funds was really complicated even though it was only 28 thousand. On whtsap there was no response at all, Vidio unboxing was sent but it was still said that only 2 products were lacking 🔥 The refund was only 28 thousand rupiah. Not trusting, taking people's rights; 0; acc; 1
some are broken, even though it is placed in the middle, others are not defective, small pieces that are broken can be outside the plastic. if the stock is lacking, why don't you chat first, order green5 which is 1 beret. Order yellow 10 of which 1 is given yellow mix white. ; 0; acc; 1
As for the goods, it's ok, I'm a little annoyed because the delivery of the goods is one day late so the warranty period must be extended; 0; acc; 1
It was very annoying even though I ordered the white one pink but the one sent pink. There is no photo because I'm lazy to take a photo😏; 0; acc; 1
Please repair the packaging again, when you open it, the glasses are broken, ah very disappointing; 0; acc; 1
THIS SHOP IS NOT TRUSTWORTHY, I WILL TELL YOU EVERYONE WHO WANTS TO BUY HERE, IT'S BETTER NOT TO. I DIDN'T SEND MY STUFF, WHEN I WAS ASKED ABOUT A LOT OF CINGSONG, I PRAYED FOR MY BLESSING THAT MY MONEY WAS NOT, EAT IT! THE POINT IS ONLY GOD KNOWS, NO BLESSING IS MONEY FOR LIFE. NOT SINCERE.; 0; acc; 1
The glasses are okay But some other items are damaged. Asked for return, not given; 0; acc; 1
Glasses were all broken; 0; acc; 1
How do you intend to sell or not, if there is no color, it should be inbox, how can you harm me, I don't want to lose it; 0; acc; 1
I already clicked the item received, even though it turns out that the item is missing one. van key chain was not sent. I've ordered four times here and 4 times I've always been disappointed because the items are not complete. Hopefully the workers in this shop will be forgiven for selling dishonestly and with trust; 0; acc; 1
The order is less one, the glasses are also hard to open, definitely a broken one, ah; 0; acc; 1
My item was sent not complete, I was told but not finished, if there is a provision just right from the start, tell me the full information; 0; acc; 1
The delivery takes a long time, the goods are also smaller than other shops; 0; acc; 1
The y glasses are not in the packaging. Even though I ordered it, the results were zonk. ; 0; acc; 1
Fraudster shop just put 11 thousand money in the pocket 😆 Pay in the hereafter, yes, you can bring 11 thousand money to the hereafter; 0; acc; 1
Actually I didn't use it in the end, it was dark 😭 sob I just can't bear to sell it again thanks seller anyway ~; 0; acc; 2
How can the trunk be raised; 0; acc; 2
One or less makes the customer disappointed !!!; 0; acc; 2
Ordered glasses but didn't have the right glasses; 0; acc; 2
I give 3 stars because there are defective items, they can't be sold anymore. Do you want to ask for a return? How confused, because this is an ordered item to be sold again. So I don't want to lose a little. Hopefully in the future, you will be more careful, the goods will be checked again before packaging and sending. Thank you; 0; acc; 3
Some of his glasses were broken; 0; acc; 3
Alhamdulillah, the goods arrived, but disappointed because they were not sent according to the order, the chocolate arrived without confirmation, for the future so that if there is an empty item please inform first sis; 0; acc; 3
The goods arrived in two weeks, the packaging was not good, damaged goods were sent, and there were 6 items not sent, I felt I was at a loss 😢😢😢😢; 0; acc; 3
How come the glasses weren't sent ??; 0; acc; 3
broken handle 😞; 0; acc; 3
The order is black but the one that comes is purple. Even though there is already a purple one at home. So it's not used; 0; acc; 3
My order has 16 complete glasses, but I ordered number 9, it's green, and 2 colors are silver, this is sent another color and two clear black because this is people's order, so suggest to the owner, please be more careful in the packaging of the goods. 🤗; 0; acc; 3
Orders have arrived and are appropriate. Just a little disappointed how come the glasses can't be opened anyway; 0; acc; 3
I ordered black and clear black, how come the purple and black colors are clear; 0; acc; 3
I was worried about reading this package because yesterday the order was not right. What this time is fortunately complete, it's not like usual, where there are always problems, either the goods are lacking or the wrong delivery, so it feels like a dream if the product can be complete; 0; acc; 3
My blue doff bottle was not sent even though it was the customer's message :'( give up shopping here; 0; acc; 3
Glasses asked for black to be sent red My loss mbak2; 0; acc; 3
There is no purple color even though the item did not arrive; 0; acc; 3
It's good at that price, I really like it, regret buying two; 1; acc; 4
Thank you for your cooperation in trading, the product is good, thank you. I like it; 1; acc; 4
The delivery is so fast it's only a day. The packing is also thick, the bubble wrap is safe. But it is unfortunate that the glasses were broken, definitely not from delivery because the bubble wrap was too thick, and the necklace was not sent but the brother was fine and a refund. Thank you sis ~; 1; acc; 4
The glasses are still good but sorry I gave them 4 stars because the glasses didn't match the order I ordered pink and white (FKC01) # 16 but what came was red; 1; acc; 4
The number of items I received was correct but there were 2 defective glasses, rubbery on the lenses / glasses. Tomorrow again please do not send defective items to the buyer. Researched first before sending to the buyer! Thank you.; 0; acc; 4
Good at a murmer price ... but given a four star because the purple glasses had Korean glue marks ... :(; 0; acc; 4
Alhamdulillah, my package has arrived, hopefully my customers will like it but the glasses are a bit dragging, but it's okay; 1; acc; 4
1 bad black glasses. the purple crackkkkkkkkkkkkk. ; 0; acc; 4
The black glasses are broken 😞 be more careful; 0; acc; 4
thank you bro it's arrived .. I just gave 4 stars ,, because not careful in packaging because my order was less than 1pcs ... yes, even though it was a refund, please improve the accuracy ... even if you have to confirm it first ... thanks , inshaAllah order again ...; 0; acc; 4
Good product, complete, all, only long shipments, when canceled, even though the seller rejected it, then just send it, what else did it take to send the old courier too much, but gpp thanks seller; 1; acc; 4
Alhamdulillah, the glasses are good, cheap, they can change and can be stylish.; 1; acc; 4
The glasses are wrong color, ask for pink. Sent in red; 0; acc; 1
Good but there is a little scratch but it's okay; 1; acc; 4
Asked for ash but was sent black instead, but it's okay thanks Sis :)); 0; acc; 4
Good but the right one is about to break, a little hard to open; 0; acc; 4
Even though I asked for a clear brown one, but the love is very impressive; 0; acc; 4
The key does not work even though the number is already on 000 but does not open2 🤔😡; 0; tech; 1
Buy 6 items, only 5 items were sent, this item was not sent; 0; tech; 1
the point is that the item I ordered was damaged, and there was no response from the seller. ; 0; tech; 1
There are orders that are not sent by the seller, which means that the process of checking goods before they are sent is not good; 0; tech; 1
The goods in the store are not updated, in the end the consumer loses due to using the Shopee return scheme, in which the money returned is smaller than the purchase price; 0; tech; 1
next time, if the stock is already hbs, the stock should be 0. so it will make a loss, the long response is like snails 👿👿 it's better to just sell meatballs; 0; tech; 1
Don't imagine that this will be anti-theft. Material only from plastic, not sturdy; 0; tech; 1
Purchase a package with a 120cm 3 port usb hub cable..tp the real cable is 20cm. This means that the supply of BRG from the shop is not ok ..; 0; tech; 1
The padlock cannot be locked and unlocked; 0; tech; 1
Regret shopping here. Cheap products but products shipped defective and the goods did not arrive. Have to fight with the seller first; 0; tech; 1
Cannot change the code; 0; tech; 2
Very not recommended, instructions for using Chinese, once failed, it can't be used; 0; tech; 2
It's good to arrive quickly but unfortunately there isn't one item 😒; 0; tech; 2
I was ordered by the paper motorbike with the signature I threw away, the rules were to check before sending it 😔; 0; tech; 2
The item has arrived The item is according to the order The product price is very affordable. But the password cannot be changed; 0; tech; 2
Order 3 sent only 2 build quality is not good; 0; tech; 2
Broken, can't change the code; 0; tech; 2
The key number cannot be set incorrectly; 0; tech; 3
It's funny that passwords are so easy to steal; 0; tech; 3
I still can't set the code, I already followed the instructions, let me know how, I'll change it to a 5 star; 0; tech; 3
Quality according to price, not bad for just a lockable bag style .....; 1; tech; 3
It's hard to enter and the code lock always makes an error 'and can't even be opened; 0; tech; 3
Even though it's locked, we still press it, it opens a little. Not too safety for an important place I think .; 0; tech; 3
When dialing the combination number, it seems very prone to loose; 0; tech; 3
The item is good and works, it's just that there is an interval of 1 milli when it's locked. ; 1; tech; 4
In the lock part to open the lid, it looks like the material is plastic, it looks like it's easy to force it to open, but it's OK with the price of 3 thousand ,, :); 1; tech; 4
Other items are okey not bad, only the micro USB to type C converter doesn't fit into charging so it doesn't use; 0; tech; 4
You don't need to wear a padlock with a key, heheh. Thanks, anyway, I like all the products; 1; tech; 4
The material is not sturdy enough, but it works well ..; 1; tech; 4
I think the size is big, it turns out to be small, only used for the size of a zipper bag and can't use it to change the real key please explain if anyone knows; 0; tech; 4
Padlock Lock Padlock Swiss Genuine Travel Bag, pretty good cute, is it strong huh? ; 1; tech; 4
Not bad for this cheap price. Without don't use it to lock up very important things. This is more fitting for privacy; 1; tech; 4
the lock is good, the delivery is a bit long, but I have followed the instructions but I can't set the number on the lock; 1; tech; 4
Don't understand how to use it, don't lock it, it's good for hangers; 1; tech; 4
The lock is okay. Works fine. The password is 109. Just confused about how to change the password 😂; 1; tech; 5
The padlock is very good, there is a pin too, if the bag on the road can be locked; 1; tech; 5
The lock is good. This is cool for locking suitcases or doors. It's not too complicated to find keys ...; 1; tech; 5
Antique, unique and combination of numbers tk only 000 ..; 1; tech; 5
The lock is good, I like it all functions well, the package is complete, nothing is lacking top; 1; tech; 5
Small according to price but not bad for locking a suitcase; 1; tech; 5
good, fast until it arrives, the lock is functioning properly. Setting the key is also easy ..; 1; tech; 5
The product is in accordance with the price of the item ... it's not bad for locking the locker door in the office 😄; 1; tech; 5
The zipper lock has arrived safely, delivery is also fast, changing pins is also not complicated, recommended; 1; tech; 5
The lock is good as expected, guys ... can be used all, where the price is really cheap again ... thank you, min; 1; tech; 5
Happy shopping here ... varied from batteries to mini locks too hehe .... The most awaited is the battery is the same as my son, because he made toys hehe ...; 1; tech; 5
Top. All items are functional. Got a good price and quality is not fake ... it's great to shop here ... thank youhhhhh; 1; tech; 5
The goods are really cheap ... Good, there are no defects in terms of appearance ... Or if you use it quickly it breaks or not hopefully not ...; 1; tech; 5
So cute, But we can't set the code myself, the code is already available. It's okay, I like it, .🔒; 1; tech; 5
Functioning normally. 3 numbers can be changed. It's easy to change the 3-digit code number as you wish. However, the description of changing the digit code included is not at all clear. 😊🙏 Poor packaging. Fast delivery. Thank you; 1; tech; 5
Thick packing, good. Packing process, fast delivery. Very good material for the price of 3,000, setting the password code is also easy and works well. ; 1; tech; 5
The items are real good like in the photo, don't hesitate, bro, let's attack this shop; 1; tech; 5
The normal function of the item is according to the picture, but the power is not so strong, the problem is that it is pressed using one hand, immediately Oblak, what else can I do with all my might the rest is okay; 1; tech; 5
The pictures are cute cute cute ... hopefully it can be safe for the bag .... and strong, aminn original product and safe delivery huh; 1; tech; 5
good, useful, can change the code, it's bouncing, murmer price; 1; tech; 5
It's a bit fragile ... not as strong as the expensive ones. Hehe .. But it's not bad to make safe when traveling, at least it's not easy to open right away .. thanks; 1; tech; 5
The lock is good, Mayan, for the lock of the suitcase, when going home is good, it's just that the lock is small according to the price, it's good, it's quite expensive, the delivery is also fast, really cool; 1; tech; 5
I got a good one and it works well thanks even though I was scared of zonk; 1; tech; 5
For this suitcase, it is very useful for the other keys, too, ok. It's heavy too.; 1; tech; 5
really suitable for those of you who want to travel or peak. besides the quality that is okay. Price is friendly too. very close like you to the him ..; 1; tech; 5
The keyboard is shipped with a defective condition; 0; tech; 1
Alhamdulillah, the item arrived in broken condition, plus the cs didn't want to respond to complaints, not recommended seller Disappointed lur; 0; tech; 1
I received the goods broken; 0; tech; 1
Really bad taste from the box that looks like used and some buttons don't work properly you have to press firmly hmmmm, then I can give an assessment because the item arrived when I wasn't home 😭; 0; tech; 1
It really can't be used and is badly damaged, and the seller doesn't want to be responsible for the damage, I hope all buyers don't ever want to buy anything in this shop ....; 0; tech; 1
Sorry 1 star Bad stuff, many are not functioning that only function 3 letters next time please make sure again, admin in chat does not answer really disappointing; 0; tech; 1
Disappointing The letter E is the same as H, it can't be pressed where it is too sensitive to press 1 letter that comes out 3 letters, I realize this is cheap but at least think about the quality as it is cheap so you give it carelessly to consumers, I want a little explanation, bro , please stop it .; 0; tech; 1
i regret bought it here (I'll ask for an account to be ENDED later) watch out, you don't want to buy in this shop.; 0; tech; 1
SEND WRONG GOODS !!!!! AND THE PROBLEM IS TAKEN TO COMPLETE THE SAME SHOPPE..2 A GREAT LIAR !!!!!! DONT SHOPPING AT THE SHOPPE PLEASE ... !!! ALL IS LIAR .. !!!! THIS STORE is SUCK ALREADY SUBSCRIBE, NAUGHTY AND OFTEN SENT WRONG ITEM .. !!!!; 0; tech; 1
The keyboard arrived but it can't be used, how about it, uncle ??; 0; tech; 1
1 part of the keyboard is dislodged and can't be applied anymore ....; 0; tech; 1
It's strange why it's a double double. Where's my fault ?; 0; tech; 1
Items sent do not match the purchase; 0; tech; 1
The goods arrive in a cracked state, the left and middle ends are broken; 0; tech; 1
Not as expected; 0; tech; 2
keyboaard error, can't be held long (hold). then sometimes when you hit a lot the letters are double. yes, the intention is to want 1 star, only on time delivery. so okelaah. don't add 1 more star; 0; tech; 2
I am a little disappointed with the packing until the goods are broken in the corner. For the future packing, pay attention not to the goods being damaged or broken again. Fortunately I need it so I just accept it. Hopefully the goods are safe and without any symptoms; 0; tech; 3
Many of the buttons don't work but for fairly fast delivery; 0; tech; 3
the packaging is using boxes and bubble wrap, but there are still cracks even though I have accepted it. price according to the quality of goods ..; 0; tech; 3
The goods arrived, the courier was friendly, the packaging was neat, unfortunately the enter button was not functioning properly ..; 0; tech; 3
The goods match the picture, but the delivery is slow ...; 0; tech; 3
It's good .... unfortunately it can't be used; 0; tech; 3
Goods fit and function normally, just a little disappointed because there are broken parts; 0; tech; 3
Actually it functions but the goods arrive in a broken state on the side and on top; 0; tech; 3
The keyboard may have broken due to the road, but it still works fine; 0; tech; 3
Mending look for the one that costs a little. The product is too fragile and thin .; 0; tech; 3
Admin fast response :) Thank you! But long delivery :( broken goods😭 not safe :( sorry; 0; tech; 3
The There are several problems on the keyboard; 0; tech; 3
The seller is a con. Color sent does not match. And the receiver doesn't exist .; 0; tech; 1
Please mf, I give one star because the item I received is incomplete, there is no receiver ... already complained, but it is considered lack of evidence because there is only a photo, no unboxing video ... thanks for the response; 0; tech; 1
Doesn't fit the photo, on the rich blisters that I used; 0; tech; 1
Somewhat disappointed at the shop. The packaging is only wrapped in a cardboard box so the product is damaged due to the squeeze. Then I asked him to give black color orange. The product is indeed cheaper. The product has not been tested, hopefully it will be okay .; 0; tech; 3
In terms of materials, it's good, but the receiver is behind it. But the seller's response is okay and fast; 1; tech; 3
Sad... I think it is charged like my other wireless mouse .. The description doesn't have any words. It's a bit dragging, then if the battery shakes it turns off the mouse function ... So the battery has to be bumped so it doesn't shake .. Even though I wanted to buy one without a battery. ; 0; tech; 3
Fast delivery, but stick 2 not working properly. Difficult to set up; 0; tech; 2
There is a broken PCB board; 0; tech; 1
on one of the joysticks the R1 button can't be used, and the R2 button clearly looks used, what's the selling opinion?; 0; tech; 1
It can't be used, please turn it over the hassle and it's already broke; 0; tech; 1
Items are shipped only in bubble wrap. So it was damaged during delivery. Because the price is cheap so what can I do; 0; tech; 1
the item arrived long ago even though it was the same as Jakarta, the lt and y buttons often pressed together like the rb and b buttons; 0; tech; 1
A malfunctioning stick can't be read on a laptop or Android; 0; tech; 1
Payaaahlah. The item can't be used. Very unsatisfactory. Lousy lousy; 0; tech; 2
THE VEIL IS NOT SATISFYING AT ALL. maybe the item that i got is bad luck It's not like being photographed at all. Can see in my picture The distance between the first layer and the second layer doesn't make any difference. Poor !; 0; fashion; 1
Not suitable .. Hopefully not on purpose ya one star once .. I've often informed the shop ... Please block it ... I also bought it again; 0; fashion; 1
Sorry, I gave 2 stars. The problem is the stitches are not neat. The size of the veil is different. It's a little small. Hopefully the next can be better again. Aamiin; 0; fashion; 2
They're thin like annoying baby diapers; 0; fashion; 2
Afwan 🙏🥺but all the veil stitches are really messy 😰🙏 Hopefully it can be better; 0; fashion; 2
The necinya is not neat, the material is translucent; 0; fashion; 2
The veil which is 1 layer is really small, so it can't be used, the 2 layer is really short too, really disappointed. ; 0; fashion; 3
disappointed 😭😭😭 ordered the color brown pasmina, which came in turmeric color, even though I want to use it tomorrow for my bride 😭😭 so much the color of Pasmina and veil is different aa; 0; fashion; 3
Good but not neatly connected; 0; fashion; 3
Fast delivery ,, but the stitches are slobery; 0; fashion; 3
the method is that the one layer is short and small, for the 2 layer it is all thin, but not neat; 0; fashion; 3
There are many stitches that are not yet neat, you have to tidy it up again yourself; 0; fashion; 3
a little disappointed with the veil rope tal the price is a little more expensive than the place I usually buy ... the delivery speed is good, but a lot of threads come out and there are small holes like the wrong stitches ... it will still be regular, but not for veils the rope. sorry (((; 0; fashion; 3
Subhanallah the stuff is really thin. It's not wide either, it's just long. Not satisfying. When is the day I bought it at another shop, the price is the same but satisfying. Use written below ⭐️4 blocked again. Yes, I can't just cheat on other potential buyers. I'll be disappointed too. Please, sis, criticism is good. ; 0; fashion; 3
