text; label; domain; star
Recommended, friendly and patient sellers make satisfy in explaining the goods, ori approved, Trusted sellers, satisfying to buy here; 1; tech; -
Like it 💜 has been checked and IMEI is listed, the item is original guarantee 😆 (it is not greenpeel, it has also been informed by the seller when order is no problem 🙂, warranty on 2 feb received 9 feb) The item is smooth, the package is neat and safe, the seller is friendly and informative . Severe friendly prices. Recommended! Thank you!; 1; tech; -
Thank you, finally the package arrived in yellow, it was checked on apple.com and the item was original ... the price was cheap ... because the delivery from Batam had to be patient for a few days waiting for an update from the courier, but the package was sure to arrive ... success for the seller huh ya 🏻🙏🏼; 1; tech; -
the packaging is only from buble wrap instead of wood as I see in other testimonials, it's a bit disappointed. but the item arrived safely and was a little late from the day that was predicted by the ORI seriously; 0; tech; -
Original product and the response from the admin was very friendly, the response was very good. Buy purple but unstable want white, but the admin is good so it's okay to replace white. It's been 24 hours of use so far, okay, okay, and hopefully it will continue too. Don't regret buying here!; 1; tech; - 
acc safe items Original sellers are patient and kind in answering questions that are very drama because the shipping service is too late 👌🏻👌🏻 Competitive prices 🥰😘; 1; tech; -
Alhamdulillah until 'the first time I bought a cellphone online and was worried but thank God the item was original and imei registered and all of my questions were responded well sm admin' thanks yah ... smoga add online sales success the best 👍👍👍; 1; tech; -
The seller is very friendly. Degdegn also bought online, but finally the package arrived safely. Order on 30 October, package until November 6th. 7 days waiting, must be patient. Safe packing and smooth production. Just review 2 days after arriving because I want to check first and it's safe. 10/20/20 Guarantee thanks; 1; tech; -
cool bangett! oriii just checked on apple.com good luck !!!; 1; tech; -
Okay stuff. Without any less. The delivery is really severe. The receipt is shipped to shari then the receipt is canceled. 2 days later the package was truly sent. Delivery from Tanjung Balai Karimun, not from Jakarta as it appeared in the store location. 👎; 0; tech; -
- Services (4/5) responsive, all questions are answered patiently - Delivery (5/5) Use a store courier, fast, safe -Products (5/5) The original BNIB greenpeel is not active Thank you seller!; 1; tech; -
Buy 3 mobo 1155 2 good 1 dead, return will be repaired, if it is damaged it will be guaranteed to be the same eh ... there is no further action from the seller. I hope there are benefits.; 0; tech; -
Fast shipping but unfortunately the LDC is not original because the sensor is unresponsive, the picture is not sharp and the color is yellowish, although I know this is second but it is unfortunate.; 0; tech; -
Immediately used and really satisfying, although first confirmed if the goods are empty but the next day it was tried to match the order and arrived, even though it turned out nano + esim tp gpp, thank you sis💕; 1; tech; -
Thanks, as expected, the price is the most humble but the quality of the goods same and 100% original, the seller always responds kindly, successfully. Thank you and success always 🤗; 1; tech; -
The printer does not work as it should, when I print, it actually freezes. when the paper finishes printing the results are like that. in the store writing 7 days return, but I even sent to the HP service center for warranty claims, if like this I am the same as working twice and buying a printer to the shop; 0; tech; -
Order 2 but only come 1 request a refund for items that are not there but are made complicated, the cash price is not too much but I will not buy it again; 0; acc; -
Why is this bottom missing? New model or what? Then the fragrance is also very unpleasant.; 0; acc; -
Buy several orders in 3 days, the seller is not careful and sends the wrong size. When I asked, I still didn't think carefully about the order yesterday. Fortunately, this time I was refunded, it was tired but. Uda is last time buying here, bhay; 0; acc; -
The color does not match the picture. When I asked why that was the reason ‘we changed colors because the customer didn't like the previous colors' why didn't I ask me that way before ... disappointed how lazy I was to ask for a refund because he insisted on his own; 0; acc; -
I once bought the yellow (the left one) so the color, uh the second one came the color is very faded. The shop is not consistent, the seller is asked, Capede; 0; acc; -
New item arrived. There was a defect and it couldn't be removed; 0; acc; -
This application is very firm customer service. He was wrong a lot, I gave 1 star ... eh he got angry. Try to watch the audience ~~; 0; acc; -
Very good, no regrets, this is a pen to buy again, the recommendation is expensive but the quality is dbest at the time, not regret it, yes, even though it's really good because of this condition, yeah, so the answer is - +2 weekly already quarantined on the road though; 1; acc; -
Very casenyaa furniture I just knew that would be soooooo wow. There are a few blisters but it doesn't matter👍🏻; 1; acc; -
Very good, the color is right. Worth it to be purchased at a price below 50k. The delivery is also quite fast. But unfortunately the surface is rather slippery.; 1; acc; -
Wait a long time, but understand because it's from China, but choose the purple color, it comes in pink😭 I am ready for the bikos, the material is good and good ”uhuy; 1; acc; -
It turns out that the information is faster than the statement! A very good oath. And the material is thick + smooth. Bgt real pic !!!!!! ✨✨✨✨ ♥ ️ ♥ ; 1; acc; -
Alhamdulillah, the product has arrived, even though the delivery is almost a week, it's fine "because of the plague situation too. The quality of the product is very good, the order is as ordered, the seller response is also very good and friendly, this will be a subscription; 1; acc; -
Finally the long-awaited arrival yuhuuu, the delivery really took a long time, it was in acc ordance with the date of the shopee warranty, the quality of the product was very good for me so seriously! Must-have, perfect products !! Thank you💕💕; 1; acc; -
Very good and neat packaging. The color also matches what is drawn. Does not disappoint, delivery is quite fast. And given a bonus key chain.; 1; acc; -
this woii case is really good Next time, I'll buy it here again️️️️ Get a bonus key chain too, it's fun🥰🥺; 1; acc; -
The case is hard and it's narrow d the package is like an anti-scratch crack the camera also doesn't fit the shape :( but the material and color are good; 1; acc; -
The color of the casing is in line with the expectations, it's already used ok, but there is a little chill on the right side of the screen, the rubber casing is flexible, the corners of the casing are also sturdy hard, pretty well the casing and hrga are also affordable; 1; acc; -
Translator make sellers and buyers be together. The seller is very communicative, i pick the color but pick the wrong number then wants to ask and correct it 👍🏻 Plus get a cute keychain bonus; 1; acc; -
It is really great that Poko is very sorry to buy here the ingredients are soft and elegant; 1; acc; -
The owner was very kind at the beginning the order was already given a bonus, at first I was hesitant because I was afraid it wouldn't sell but then the item arrived immediately rushed to the location without being rushed to the full photo just thank you sis! ♥; 1; acc; -
The key chain is good ... suitable for souvenirs that are more ...; 1; acc; -
Nice cute unique hangers, wife also likes ... Next, God willing, I will order again ...; 1; acc; -
The bracelet was really funny, but it came a long time ago :') I like it, but I don't know about how to make the string complicated😅 Overall great; 1; acc; -
It turns out that there is a smaller q no de that is indo ... is it really possible that the model is different ... usually it uses 8 on the ring finger ... this is 8 forcing. Which 9 is enough d ring finger😅👍; 1; acc; -
Not good, the letter came off; 0; acc; -
From December 8, 2019 to the present day, January 4, 2020 there are no items. 😂 Don't know How to want to be assessed dinilai; 0; acc; -
The earrings are cute, but unfortunately many of them bend the back so it can't be used 😭😭😭😭; 0; acc; -
uchul, the earrings are murce but good, don't send the wrong items (according to the order), they are cute, get more butt earrings, though, the Pokok is great! thankyou; 1; acc; -
Very funny realpict. Next order again, regret the pinnings cmn buy 1 huhuuu so cute I want it again :)) the earrings also hopefully won't be an item; 1; acc; -
Really good even though it took a long time but it's really worth it to buy at this price, I've got 6 pcs earrings that are super duper cute and suitable to use to go out everyday. Thx yeah; 1; acc; -
For a long time, only understandable. Nice earrings, friends ask. Hopefully can order again. Funny....; 1; acc; -
it's good, even though there are some that aren't straight, you can spare two supports as well; 1; acc; -
After checking the reconditioned goods, it is not as expected. The wifi can't. Though already using the best hotspot. Still can't connect. This is a bad stuff.; 0; tech; -
Goods according to the description, the seller is also responsible ... there is a cable that is less replaced Hopefully durable goods ... hopefully the warranty is not used alias safe goods; 1; tech; -
just opened dos ,,, and operated for a while ,, not yet after a day the cellphone error can't be turned on; 0; tech; -
I don't think that I will be fooled by this .. Starting to suspect that when I use it for 2 days, how come it's already slow .. Then how come the name of the model on the cellphone isn't Redmi 9 but the model isn't clear .. I think it's because the RAM is really small .. Then I tried going to Tokopedia for trade-in .. When I checked the IMEI, it turned out that the model was not found; 0; tech; -
Not good, it should be improved again. Items received are not in good condition. I'm sick and can't return goods. I'm just alone. No one can ask for help Very disappointed with xiaomi. You are guilty of hurting orphans like me; 0; tech; -
The delivery is very "bad and does not recommend pdhl to the shopee express sameday and still the tangerang area, the period of 3 days doesn't send" smpe "you have to go to the shopee'y warehouse. Very disappointed it is better to go to the next stall not trivial". Make friends "who are brg 'y not sending "Tangerang area dtg to the iconic beautiful ambassador; 0; tech; -
jnt very bad delivery transit up to 4 days !!!! Please coordinate more in the future, the official shop is officially sending the package how long it takes. !!!!; 0; tech; -
A shopee mall class is also the official official, the packaging is bad, another shop 2 days, the goods are up to 2 days, still packed ..; 0; tech; -
Initially very happy there were no problems but only 3 days of use the gray color was already black screen (initially there was no sound, no picture) after that the sound was also lost and really couldn't turn on ... SO WAS DISAPPOINTED, even though it's been a long time waiting for a new cellphone; 0; tech; -
Xiaomi x ShopeXpress = 👎 Why are you only given the choice of a courier? There are no other options even though you often buy, you can do it other than that. Xiaomi Redmi 9 is okay, but when combined with a courier that is not okay. Customer satisfaction has fallen ...; 0; tech; -
The cellphone just until this afternoon now turns off suddenly even though the battery is still 87% why I chat there is no reply from the xiaomi official store. Please ask for your help what to do I am very disappointed.....; 0; tech; -
The cellphone is much different from the original one .. It is hoped that those who want to buy are better think about it first than later.; 0; tech; -
The item is smooth ... but it's a shame when I try it. The speaker has a problem ... there is a crackle sound; 0; tech; -
The item is in a defective condition, the account is locked when connected to wifi, the defective product is refurbished, it's been 2 weeks that the return has not been processed, if it's not processed as soon as possible just think to charity it, disappointed sm seller of this HP product; 0; tech; -
Battery Boros LCD Ghost Touch Emmc reconditioned (dead and serviced cellphone) Know that if emmc is not the original; 0; tech; -
Just like get scam when the new cellphone is locked, right?; 0; tech; -
Bli 6units ... 2 units are damaged ... 1 hit with signal ic, 1 ic lamp ... Once open inside ... the used ones have been hit by water ... Don't sell people's returns, boss ...; 0; tech; -
The cellphone was used for almost two weeks, last night i charge it and it can't turn on, I didn't want to, I don't know what cellphone was sold; 0; tech; -
The item arrived, after a week of using the cellphone I couldn't use the charger at all, after checking with the repairman he said that the cellphones were all in order, only the cases were new ... really disappointed 😠😠; 0; tech; -
asked if the new jwb is "new", the thing is that it's just reconstructed, can you play the word, the warranty seal can be stuck in the middle of the case so you don't see the original, loose battery, rusty conductor, it's not all the contents, in odd everything else, just a day's use just turns off !!!; 0; tech; -
Once check, the first one is good, the second is bad, chat about a return, bls ... it's time to buy fast bls ... the cellphone can't be used because the account can't enter the xiomi ,, the app is locked ... don't be stolen or how ,,; 0; tech; -
the bolt in there is not there 2. the screen is stuck. the seal is not there. please fix it ..... before sending make sure the goods are good.; 0; tech; -
The cellphone signal lost then the goods returned, but he said, he still didn't receive it. Even though the receipt was sent and until Thursday kmaren. Pdhl need a cellphone for school nephews.; 0; tech; -
Be careful to buy item here, the seller has no responsibility, i buy 5, 3 was damaged auto bankrupt; 0; tech; -
Love star bai1 first defective micro sd slot does not work, but the seller's response is very good and wants to be replaced with new items. LG is still in the process of returning. Hopefully the goods will be back soon. Later, when you arrive a new one without minus change it to a 5 star. Because the seller's response is very good; 1; tech; -
So far the cellphone is good. Good signal, good wifi, good Bluetooth, good camera. Charging is quite fast but there is 1 that is still lacking. The battery runs out quickly and sometimes the cellphone likes to heat up. Bang ... I checked that the microphone didn't work. How are you? Thanks; 0; tech; -
Goods do not match the order, ask for returns instead waiting for the decision of the shop and the shop is more in favor of the shop not the buyer, evidence already exists but the buyer is wrong, the price is not disappointed but not according to the order f*ck; 0; acc; -
It's not quite right for the redmi 8a pro flashlight it is closed, but it still works because the back is clear. The design is cool, it arrives very fast too; 1; acc; -
The price is murmer but not cheap, my husband likes it just a pity, the one I choose the wrong variety is really good even though it's good; 1; acc; -
The item has arrived, the ingredients are also good, the delivery is also fast. It's a shame for the dark green case there is a white appearance, it's been cleaned but it's still there. But never mind, thanks ...; 1; acc; -
Really thick and not lethargic, guys, don't regret buying. Next, I want to buy again for other variations. Hope fast restock for the clear variant, really want it but it's finished 😭; 1; acc; -
It was beyond expectations, I thought I would get the bad one because I saw it in other shops, ehh it turns out that it is really good, really precise again, even though I ordered a matte black one but, because I finished choosing a light green matte one. This is really recommended, goodjob seller🤙🏻; 1; acc; -
Good case, fast delivery, its just that in the shoope notification there is no information if the case has been sent but it doesn't matter, the important thing is the case is thick, thank you; 1; acc; -
This is how the word wants to return the cellphone ... how come I bought the damaged cellphone ... how come there was no good intention, you were looking for a fortune, how come this is the way ... sorry I won't bought a cellphone here; 0; tech; -
After almost 1 month the cellphone screen went dead. Though normal use. Try asking the seller there is no answer.; 0; tech; -
Black message that arrived white. The sound next to macettt. Please fix it again so that the customer is not disappointed. There is a sound on the handset. Not recommended. Sorry; 0; tech; -
It only lasts a day and the delay is really long. And the price is expensive in other shops, only 60K; 0; tech; -
Items do not last, likes to disconnect themselves and foreign languages continue to appear, the battery is not clear, it is at 100% status but likes to die alone.; 0; tech; -
Like to live and die alone even though you don't squeeze at all; 0; tech; -
VERY BAD PRODUCT QUALITY. BOTH THERE WERE A CRUSHING VOTE. ONCE JUST BUY THE PRODUCT HERE. SELLER RESPONSE IS ALSO VERY LONG. IT IS NOT RECOMMENDED.; 0; tech; -
The goods have arrived But the goods or what is not good ... If both of them are activated, sometimes only one side is heard and the other one dies. Sometimes the music turns off by itself is not clear. Service is also not good enough; 0; tech; -
Really regret I bought this handset. Already the left side is less responsive, the battery is bad. His voice was kind of rising. Charging until it is full when you eat it for a while, 20% is left immediately. It's a waste of money if I buy this hendset. Kind of ascending. For others Loss if purchased.; 0; tech; -
The used products are damaged but still sold, if the used goods are second give it in the description,; 0; tech; -
The sound of the right and left is not the same, I like to be confused about how to turn it on, how come it's hard, it's also hard to stick it in the ear to keep falling; 0; tech; -
There was no sound on the left, like cricket crack in a dirty box, but on the right it can run the bass feels good; 0; tech; -
It goes melted down, JBL, once it was installed, it was immediately quancunghe, not the usual English language, bluetooth connected but cisngchungchei, I ordered the black color that came in white. already like that, it doesn't connect left and right, it is really ugly that only the right one is alive, I don't know what item is it, it's ready to go straight away; 0; tech; -
I'm really surprised that the sound is really cracking when I use it. Why don't you try it first, what's the good condition or not. Why items like this are for sale. I am very disappointed; 0; tech; -
Just used three days. The condition of the item when it is turned on and used immediately turns off itself. Even though it's already in full charger. Chat with the shop is not answered, until the warranty period is up. How is this boss?; 0; tech; -
If you buy from the seller, it seems lucky. "When buying a product, I bought 2 earbuds, one is good but the second is defective, in the chat," I didn't reply as quickly as I bought the previous product. Please also check the quality of the product before sending.; 0; tech; -
I didnt find a good blutut hedset and finally I bought this product, the item is really good, the bass feels like a deaf ear, good for motorbikes, not afraid of getting tangled with wires, if my ears are small, maybe a bit often dislodged but it hurts like me. But good !!; 1; tech; -
It can't work, the red light continues even though I have unplugged the charger, and I can't press off. The item has not been used at all, even though it says 7 days return. It was my fault because the click was accepted before trying, because it never happened like this. Chat to the seller is useless; 0; tech; -
The sound is really good, but every time I want to register the warranty, how come it fails because SN is not registered. Even asking via chat can't solve the problem and I can't see the authenticity of the product which is original. How dare you sell the fake product?; 0; tech; -
Since the product has had a problem, the red light can't be turned off. I've been looking for a way on YouTube, finally the red light can go out. After that, turn on the jbl, turn on the Bluetooth, but when pairing, the name doesn't appear at all on the cellphone even though the light is flashing blue blinking fast (pairing).; 0; tech; -
Defective products do not buy in the contents, say the original ori is only used for how many days it breaks, the battery runs out right in the charger instead it turns red and doesn't turn off "On the turn it can't just replace it. Anyway, don't buy this product, don't buy it like I buy expensive "The quality of pickled cheap stuff; 0; tech; -
The delivery was really slow for 6 days Jkt-Bali ... The battery doesn't last, it's been charged for 5 hours, it's just been used for about two hours, it's already dead ... If you chat with the seller ... it's useless ... it's a human robot so don't hope connected .. For this product for 799 rb ?? NOT RECOMMENDED 👎🏻; 0; tech; -
Good quality, but doubt ... this is genuine or not. The problem is that the cable charge is so ... now there are a lot of 1: 1 cloning tubs ... let the photo talk And not abs to the mall, see directly Eng ing ... This is a FAKE fix ... SORRY I CHANGE stars and add more honest reviews ny; 0; tech; -
Alhamdulillah, the goods arrived well, as expected, the warranty has also been successfully registered, I am looking for more clear vocal voices for online learning for children. ..; 1; tech; -
First, the delivery was fast and as requested. Both voices are good, vocals are clear and clear for indoors, but the lack of bass is lacking in volume. Batrai is also quite durable too; 1; tech; -
Not bad for this price. It's a little different from what I bought directly at the store, even though it was good that I bought at the store. But this is really good for a price like this. Waiting for the discount, the discount is pooooo; 1; tech; -
The results of the sale are good. JBL Go is suitable for vocal, jazz, acoustic music. For trance music, hip hop, beat up, the sound is normal. Bass is not felt. Most maximize your audio device settings; 1; tech; -
Cool good stuff according to the picture and guaranteed to be JBL original. Come on, my friends buy ORI items and leave your items, because the guaranteed ori won't make you disappointed, instead those that last all the time😂; 1; tech; -
Satisfied with the sound quality 👍👍👍😍 The seller is also friendly and fast, please chat. The dish is okay too, complete according to order. Only the delivery took a little longer, the problem on the expedition seems to be ...; 1; tech; -
Thank you admin "who responded to the chat and quickly sent the order .. It arrived and did not disappoint, everything was complete. Thanks for the soft case & the gorilla glass has been installed, so no need to buy separately 😍😍😍; 1; tech; -
Original quality is definitely an official guarantee, low prices, the color of the cellphone is also up to date, the delivery speed is faster than the estimation in the PO. Hopefully this lasts longer than the previous cellphone which is up to 4 years old still can be used, thank you xiaomi; 1; tech; -
Always like it when shopping at the official official The stuff is good Still the seal Guaranteed the quality is fast, Sorry the news is different because the item is immediately used Tq u redmi official Tq u shopee; 1; tech; -
Buy on the 26th when it says PO 14 days, but fortunately the 30th has been sent and I have received the 31st. Now it's been 7 days of usage, Alhamdulillah, it's smooth. Only in the box there is no guarantee card but it says you can use a purchase invoice. Hope it lasts. Thank you!; 1; tech; -
Wow, it arrived so fast 😍😍 not until 3 days it landed in the hand! Alhamdulillah, the condition of the goods is okay, the cardboard is put in another box and there are no dents at all. The items in the box are also complete, the charger and cable are functioning properly. There is also a warranty card. Mantaaaap 👍🏻👍🏻👍🏻; 1; tech; -
Everything is complete, nice and completely flawed mace. You try and immediately use all kinds of good sensors, performance is also good. Thumbs up, this Zuzur is the first time to buy an online cellphone and don't worry because it is directly on Xiaomi.official. cheap, reliable and safe; 1; tech; -
Ordered Friday afternoon Saturday afternoon arrived, I just gave an assessment because this afternoon was working hihi, so cool, the cellphone packing is safe, I get lots of photos, basically according to the specifications and really satisfied, thank you very much, hopefully the cellphone lasts; 1; tech; -
Super fast delivery for only 4 days .. Goods have been received and in good condition .. No scuffed .. Initially the cellphone couldn't be activated anyway .. But it can be resolved .. Can be activated again and function properly .. It's been 3 days in use .. There are no obstacles .. Those who ordered are also satisfied .. I am happy .. Thanks; 1; tech; -
